{"budget_status":"provider_limited","cache":{"invalidated_nodes":[],"key":"4ed51339efad47a7d56cde76c9e80612d3f57e2eccfe88d4c23fdf6cb2d083a9","status":"miss"},"draft_id":"d0d3ffc196e0635a096837f59d18f774","edges":[{"confidence":"lexical","evidence":"provider timeout","id":"EDGE-001","kind":"references","location":"webhook/idempotency.py","provider":"builtin","source":"NODE-001","source_sha256":"79a0e348ab9d78fc9ea7da81fc66084345010e15f850e8d55441e0ec438e91ad","target":"NODE-002"},{"confidence":"lexical","evidence":"provider timeout","id":"EDGE-002","kind":"references","location":"webhook/delivery.py","provider":"builtin","source":"NODE-002","source_sha256":"d81f4da323713d7116d02f37a268c23afd7f8d612a25d44c120f3f866456cda1","target":"NODE-001"}],"frontier":[{"id":"FRONTIER-001","node":"NODE-001","reason":"provider unavailable; built-in fallback used: ast-grep, codegraph, scip","risk_domains":["operations"]}],"nodes":[{"confidence":"structural-inferred","id":"NODE-001","kind":"event","label":"webhook/delivery.py","location":"webhook/delivery.py","provider":"builtin","risk_domains":["operations"],"source_sha256":"d81f4da323713d7116d02f37a268c23afd7f8d612a25d44c120f3f866456cda1"},{"confidence":"structural-inferred","id":"NODE-002","kind":"configuration","label":"webhook/idempotency.py","location":"webhook/idempotency.py","provider":"builtin","risk_domains":["functionality"],"source_sha256":"79a0e348ab9d78fc9ea7da81fc66084345010e15f850e8d55441e0ec438e91ad"}],"paths":[{"distance":1,"edges":["EDGE-001"],"id":"PATH-001","nodes":["NODE-001","NODE-002"],"risk_domains":["operations","functionality"]}],"providers":[{"confidence":"lexical","executable_sha256":null,"name":"codegraph","status":"missing","version":null},{"confidence":"lexical","executable_sha256":null,"name":"scip","status":"missing","version":null},{"confidence":"lexical","executable_sha256":null,"name":"ast-grep","status":"missing","version":null},{"confidence":"structural-inferred","executable_sha256":null,"name":"builtin","status":"ready","version":"builtin-v1"}],"receipt_id":"4ff37b9c72927ac43c202fd5a3ba918d","repo_root_sha256":"0e00ff4f63aa2ffe726593d853b9745286f0ed662c0e3ffef65f2567995c8a0f","request_sha256":"b47933d659edef5e26d745f3e42c2520d44982ad65692b15c9aa9d6f2ef3f1d3","schema_version":1,"settings":{"deep":false,"enabled":true,"install_policy":"never","max_seconds":30,"providers":["auto"],"target_seconds":10},"timings_ms":{"total":5}}