{"budget_status":"provider_limited","cache":{"invalidated_nodes":[],"key":"3d0d0de39274f31a45cc405389766569cd98a8d3dcdee0019fa38ffbd570ba5c","status":"miss"},"draft_id":"fb2c043db3ef0c544b28fd27df4c3939","edges":[{"confidence":"lexical","evidence":"profile.displayName","id":"EDGE-001","kind":"references","location":"migrations/profile_field.py","provider":"builtin","source":"NODE-001","source_sha256":"06b1b26723979a51b56cdef2dafa3b418968fac288edb5d81ad81661baf1884c","target":"NODE-002"},{"confidence":"lexical","evidence":"profile.displayName","id":"EDGE-002","kind":"references","location":"mobile/ProfileDecoder.swift","provider":"builtin","source":"NODE-001","source_sha256":"ee5a94ece417550f3c00d6e933f7b31b1ab085169a416418cc9150045355cdc0","target":"NODE-003"},{"confidence":"lexical","evidence":"profile.displayName","id":"EDGE-003","kind":"references","location":"first.final.txt","provider":"builtin","source":"NODE-001","source_sha256":"a34332ccc213806d6ce9bce94a3e05e96385c0b0cbe5116cffb8a6be6164a9b0","target":"NODE-005"},{"confidence":"lexical","evidence":"profile.displayName","id":"EDGE-004","kind":"references","location":"desktop/ProfileCache.swift","provider":"builtin","source":"NODE-002","source_sha256":"05cdeeb66a5ea203540840f4eb0700e6650107512e70a06c48f13a24ad3b90c8","target":"NODE-001"},{"confidence":"lexical","evidence":"profile.displayName","id":"EDGE-005","kind":"references","location":"mobile/ProfileDecoder.swift","provider":"builtin","source":"NODE-002","source_sha256":"ee5a94ece417550f3c00d6e933f7b31b1ab085169a416418cc9150045355cdc0","target":"NODE-003"},{"confidence":"lexical","evidence":"profile.displayName","id":"EDGE-006","kind":"references","location":"first.final.txt","provider":"builtin","source":"NODE-002","source_sha256":"a34332ccc213806d6ce9bce94a3e05e96385c0b0cbe5116cffb8a6be6164a9b0","target":"NODE-005"},{"confidence":"lexical","evidence":"profile.displayName","id":"EDGE-007","kind":"references","location":"desktop/ProfileCache.swift","provider":"builtin","source":"NODE-003","source_sha256":"05cdeeb66a5ea203540840f4eb0700e6650107512e70a06c48f13a24ad3b90c8","target":"NODE-001"},{"confidence":"lexical","evidence":"profile.displayName","id":"EDGE-008","kind":"references","location":"migrations/profile_field.py","provider":"builtin","source":"NODE-003","source_sha256":"06b1b26723979a51b56cdef2dafa3b418968fac288edb5d81ad81661baf1884c","target":"NODE-002"},{"confidence":"lexical","evidence":"profile.displayName","id":"EDGE-009","kind":"references","location":"first.final.txt","provider":"builtin","source":"NODE-003","source_sha256":"a34332ccc213806d6ce9bce94a3e05e96385c0b0cbe5116cffb8a6be6164a9b0","target":"NODE-005"},{"confidence":"lexical","evidence":"profile.displayName","id":"EDGE-010","kind":"references","location":"desktop/ProfileCache.swift","provider":"builtin","source":"NODE-005","source_sha256":"05cdeeb66a5ea203540840f4eb0700e6650107512e70a06c48f13a24ad3b90c8","target":"NODE-001"},{"confidence":"lexical","evidence":"profile.displayName","id":"EDGE-011","kind":"references","location":"migrations/profile_field.py","provider":"builtin","source":"NODE-005","source_sha256":"06b1b26723979a51b56cdef2dafa3b418968fac288edb5d81ad81661baf1884c","target":"NODE-002"},{"confidence":"lexical","evidence":"profile.displayName","id":"EDGE-012","kind":"references","location":"mobile/ProfileDecoder.swift","provider":"builtin","source":"NODE-005","source_sha256":"ee5a94ece417550f3c00d6e933f7b31b1ab085169a416418cc9150045355cdc0","target":"NODE-003"}],"frontier":[{"id":"FRONTIER-001","node":"NODE-001","reason":"provider unavailable; built-in fallback used: ast-grep, codegraph, scip","risk_domains":["data","state/concurrency","compatibility"]}],"nodes":[{"confidence":"structural-inferred","id":"NODE-001","kind":"cache","label":"profile.displayName","location":"desktop/ProfileCache.swift","provider":"builtin","risk_domains":["data","state/concurrency","compatibility"],"source_sha256":"05cdeeb66a5ea203540840f4eb0700e6650107512e70a06c48f13a24ad3b90c8"},{"confidence":"structural-inferred","id":"NODE-002","kind":"file","label":"migrations/profile_field.py","location":"migrations/profile_field.py","provider":"builtin","risk_domains":["data","compatibility","regression"],"source_sha256":"06b1b26723979a51b56cdef2dafa3b418968fac288edb5d81ad81661baf1884c"},{"confidence":"structural-inferred","id":"NODE-003","kind":"file","label":"mobile/ProfileDecoder.swift","location":"mobile/ProfileDecoder.swift","provider":"builtin","risk_domains":["compatibility"],"source_sha256":"ee5a94ece417550f3c00d6e933f7b31b1ab085169a416418cc9150045355cdc0"},{"confidence":"lexical","id":"NODE-004","kind":"symbol","label":"INV-003","location":"decodeDisplayName/displayName","provider":"builtin","risk_domains":["functionality"],"source_sha256":null},{"confidence":"lexical","id":"NODE-005","kind":"test","label":"first.final.txt","location":"first.final.txt","provider":"builtin","risk_domains":["data","state/concurrency","compatibility","regression"],"source_sha256":"a34332ccc213806d6ce9bce94a3e05e96385c0b0cbe5116cffb8a6be6164a9b0"}],"paths":[{"distance":1,"edges":["EDGE-001"],"id":"PATH-001","nodes":["NODE-001","NODE-002"],"risk_domains":["data","state/concurrency","compatibility","regression"]},{"distance":1,"edges":["EDGE-002"],"id":"PATH-002","nodes":["NODE-001","NODE-003"],"risk_domains":["data","state/concurrency","compatibility"]},{"distance":1,"edges":["EDGE-003"],"id":"PATH-003","nodes":["NODE-001","NODE-005"],"risk_domains":["data","state/concurrency","compatibility","regression"]}],"providers":[{"confidence":"lexical","executable_sha256":null,"name":"codegraph","status":"missing","version":null},{"confidence":"lexical","executable_sha256":null,"name":"scip","status":"missing","version":null},{"confidence":"lexical","executable_sha256":null,"name":"ast-grep","status":"missing","version":null},{"confidence":"structural-inferred","executable_sha256":null,"name":"builtin","status":"ready","version":"builtin-v1"}],"receipt_id":"13bebde1d3b2db4da3689a642a5cdec0","repo_root_sha256":"9cd30e686c9227687847ad37ad5ea39713c978d04417bb980265f5356f8538a2","request_sha256":"08d4037194b151ff8416e220052d0165aa43fe3444338f6f1cb7d42e1fe23147","schema_version":1,"settings":{"deep":false,"enabled":true,"install_policy":"never","max_seconds":3,"providers":["auto"],"target_seconds":3},"timings_ms":{"total":0}}