{"budget_status":"provider_limited","cache":{"invalidated_nodes":[],"key":"918e0ca423ff13fb899cbb0a5d711058ecd86523c2bf6adf16160dbf0428b362","status":"miss"},"draft_id":"8e14c584276196790c8e84be7905b8d8","edges":[{"confidence":"lexical","evidence":"tenant archive","id":"EDGE-001","kind":"references","location":"policy/retention.py","provider":"builtin","source":"NODE-001","source_sha256":"01622f90487d1aa34520422a0fc1caf523fa7d595501377badcfda0d2da1fe53","target":"NODE-002"},{"confidence":"lexical","evidence":"write_tenant_archive","id":"EDGE-002","kind":"references","location":"first.final.txt","provider":"builtin","source":"NODE-001","source_sha256":"a65e1f046ea9c3cda1b1829bd0337c5ed0967f8315e8f20be7b7f7124ef06beb","target":"NODE-003"},{"confidence":"lexical","evidence":"tenant archive","id":"EDGE-003","kind":"references","location":"exports/export_writer.py","provider":"builtin","source":"NODE-002","source_sha256":"2f6be1943c2b584daa6b729b5cc2cd76807820b17cdfa7296a30b0049ad5709f","target":"NODE-001"},{"confidence":"lexical","evidence":"RETENTION_POLICY","id":"EDGE-004","kind":"references","location":"first.final.txt","provider":"builtin","source":"NODE-002","source_sha256":"a65e1f046ea9c3cda1b1829bd0337c5ed0967f8315e8f20be7b7f7124ef06beb","target":"NODE-003"},{"confidence":"lexical","evidence":"write_tenant_archive","id":"EDGE-005","kind":"references","location":"exports/export_writer.py","provider":"builtin","source":"NODE-003","source_sha256":"2f6be1943c2b584daa6b729b5cc2cd76807820b17cdfa7296a30b0049ad5709f","target":"NODE-001"},{"confidence":"lexical","evidence":"RETENTION_POLICY","id":"EDGE-006","kind":"references","location":"policy/retention.py","provider":"builtin","source":"NODE-003","source_sha256":"01622f90487d1aa34520422a0fc1caf523fa7d595501377badcfda0d2da1fe53","target":"NODE-002"}],"frontier":[{"id":"FRONTIER-001","node":"NODE-003","reason":"provider unavailable; built-in fallback used: ast-grep, codegraph, scip","risk_domains":["authorization/privacy","data","state/concurrency"]}],"nodes":[{"confidence":"structural-inferred","id":"NODE-001","kind":"file","label":"exports/export_writer.py","location":"exports/export_writer.py","provider":"builtin","risk_domains":["functionality"],"source_sha256":"2f6be1943c2b584daa6b729b5cc2cd76807820b17cdfa7296a30b0049ad5709f"},{"confidence":"structural-inferred","id":"NODE-002","kind":"file","label":"policy/retention.py","location":"policy/retention.py","provider":"builtin","risk_domains":["functionality"],"source_sha256":"01622f90487d1aa34520422a0fc1caf523fa7d595501377badcfda0d2da1fe53"},{"confidence":"lexical","id":"NODE-003","kind":"permission","label":"first.final.txt","location":"first.final.txt","provider":"builtin","risk_domains":["authorization/privacy","data","state/concurrency"],"source_sha256":"a65e1f046ea9c3cda1b1829bd0337c5ed0967f8315e8f20be7b7f7124ef06beb"}],"paths":[{"distance":1,"edges":["EDGE-002"],"id":"PATH-001","nodes":["NODE-001","NODE-003"],"risk_domains":["authorization/privacy","data","state/concurrency","functionality"]},{"distance":2,"edges":["EDGE-002","EDGE-006"],"id":"PATH-002","nodes":["NODE-001","NODE-003","NODE-002"],"risk_domains":["authorization/privacy","data","state/concurrency","functionality"]},{"distance":1,"edges":["EDGE-001"],"id":"PATH-003","nodes":["NODE-001","NODE-002"],"risk_domains":["functionality"]}],"providers":[{"confidence":"lexical","executable_sha256":null,"name":"codegraph","status":"missing","version":null},{"confidence":"lexical","executable_sha256":null,"name":"scip","status":"missing","version":null},{"confidence":"lexical","executable_sha256":null,"name":"ast-grep","status":"missing","version":null},{"confidence":"structural-inferred","executable_sha256":null,"name":"builtin","status":"ready","version":"builtin-v1"}],"receipt_id":"8dd972af5eb910c144b3956001a16c67","repo_root_sha256":"e5d0f316bee7323b0cb1184e3b92deaef154f8c3ed13891e85eb91f2f1fcb860","request_sha256":"7ddd0cbfaab1ce48f54dccb4eae5cd08e3b96e7a1baefd3e633f10724ac58b6a","schema_version":1,"settings":{"deep":false,"enabled":true,"install_policy":"never","max_seconds":3,"providers":["auto"],"target_seconds":3},"timings_ms":{"total":0}}