{"budget_status":"provider_limited","cache":{"invalidated_nodes":[],"key":"4464054b6e553a0e615df314510567d20f6fe34eb224937be7691bd95a1a0503","status":"miss"},"draft_id":"3c2e8c745eb104e0e913287fd080a403","edges":[{"confidence":"lexical","evidence":"offline.edits","id":"EDGE-001","kind":"references","location":"models/record.py","provider":"builtin","source":"NODE-001","source_sha256":"970d912a3f322139925546351ec49a3a0ac6fbf502e1774d0c972756e3697cdf","target":"NODE-002"},{"confidence":"lexical","evidence":"offline.edits","id":"EDGE-002","kind":"references","location":"server/tombstones.py","provider":"builtin","source":"NODE-001","source_sha256":"dac5a54c8a807d8ed81683370cc978da1fa7a71f077754107ae0b2282e3fed77","target":"NODE-003"},{"confidence":"lexical","evidence":"offline.edits","id":"EDGE-003","kind":"references","location":"client/queue.py","provider":"builtin","source":"NODE-002","source_sha256":"af39269542a9bf8b89fb4b650344cebbe8762b91157c238fe1b958345a6175b2","target":"NODE-001"},{"confidence":"lexical","evidence":"offline.edits","id":"EDGE-004","kind":"references","location":"server/tombstones.py","provider":"builtin","source":"NODE-002","source_sha256":"dac5a54c8a807d8ed81683370cc978da1fa7a71f077754107ae0b2282e3fed77","target":"NODE-003"},{"confidence":"lexical","evidence":"offline.edits","id":"EDGE-005","kind":"references","location":"client/queue.py","provider":"builtin","source":"NODE-003","source_sha256":"af39269542a9bf8b89fb4b650344cebbe8762b91157c238fe1b958345a6175b2","target":"NODE-001"},{"confidence":"lexical","evidence":"offline.edits","id":"EDGE-006","kind":"references","location":"models/record.py","provider":"builtin","source":"NODE-003","source_sha256":"970d912a3f322139925546351ec49a3a0ac6fbf502e1774d0c972756e3697cdf","target":"NODE-002"}],"frontier":[{"id":"FRONTIER-001","node":"NODE-001","reason":"provider unavailable; built-in fallback used: ast-grep, codegraph, scip","risk_domains":["operations"]}],"nodes":[{"confidence":"structural-inferred","id":"NODE-001","kind":"file","label":"client/queue.py","location":"client/queue.py","provider":"builtin","risk_domains":["operations"],"source_sha256":"af39269542a9bf8b89fb4b650344cebbe8762b91157c238fe1b958345a6175b2"},{"confidence":"structural-inferred","id":"NODE-002","kind":"file","label":"offline.edits","location":"models/record.py","provider":"builtin","risk_domains":["functionality"],"source_sha256":"970d912a3f322139925546351ec49a3a0ac6fbf502e1774d0c972756e3697cdf"},{"confidence":"structural-inferred","id":"NODE-003","kind":"file","label":"offline.edits","location":"server/tombstones.py","provider":"builtin","risk_domains":["functionality"],"source_sha256":"dac5a54c8a807d8ed81683370cc978da1fa7a71f077754107ae0b2282e3fed77"}],"paths":[{"distance":1,"edges":["EDGE-001"],"id":"PATH-001","nodes":["NODE-001","NODE-002"],"risk_domains":["operations","functionality"]},{"distance":1,"edges":["EDGE-002"],"id":"PATH-002","nodes":["NODE-001","NODE-003"],"risk_domains":["operations","functionality"]}],"providers":[{"confidence":"lexical","executable_sha256":null,"name":"codegraph","status":"missing","version":null},{"confidence":"lexical","executable_sha256":null,"name":"scip","status":"missing","version":null},{"confidence":"lexical","executable_sha256":null,"name":"ast-grep","status":"missing","version":null},{"confidence":"structural-inferred","executable_sha256":null,"name":"builtin","status":"ready","version":"builtin-v1"}],"receipt_id":"fca317dc71f08e9f89d0d894fe8772a7","repo_root_sha256":"2ec3e56809f9f74a821a6808ddc7653eab9ddd677a5c9b89d8902c99a798e8e1","request_sha256":"e4d0d53f90d71bf1353c7304054e2d0e0b267e68aa238ad3faf5271eb6f6f2ef","schema_version":1,"settings":{"deep":false,"enabled":true,"install_policy":"never","max_seconds":30,"providers":["auto"],"target_seconds":10},"timings_ms":{"total":5}}