{"budget_status":"provider_limited","cache":{"invalidated_nodes":[],"key":"107c610e09f5af897e393c283c99fb6510cf09a307ff3d949d5acceb44566775","status":"miss"},"draft_id":"55fdb32d2e06a9f5bca7b7a537753319","edges":[{"confidence":"lexical","evidence":"tenant archive","id":"EDGE-001","kind":"references","location":"policy/retention.py","provider":"builtin","source":"NODE-001","source_sha256":"01622f90487d1aa34520422a0fc1caf523fa7d595501377badcfda0d2da1fe53","target":"NODE-002"},{"confidence":"lexical","evidence":"tenant archive","id":"EDGE-002","kind":"references","location":"exports/export_writer.py","provider":"builtin","source":"NODE-002","source_sha256":"2f6be1943c2b584daa6b729b5cc2cd76807820b17cdfa7296a30b0049ad5709f","target":"NODE-001"}],"frontier":[{"id":"FRONTIER-001","node":"NODE-001","reason":"provider unavailable; built-in fallback used: ast-grep, codegraph, scip","risk_domains":["functionality"]}],"nodes":[{"confidence":"structural-inferred","id":"NODE-001","kind":"file","label":"exports/export_writer.py","location":"exports/export_writer.py","provider":"builtin","risk_domains":["functionality"],"source_sha256":"2f6be1943c2b584daa6b729b5cc2cd76807820b17cdfa7296a30b0049ad5709f"},{"confidence":"structural-inferred","id":"NODE-002","kind":"file","label":"policy/retention.py","location":"policy/retention.py","provider":"builtin","risk_domains":["functionality"],"source_sha256":"01622f90487d1aa34520422a0fc1caf523fa7d595501377badcfda0d2da1fe53"}],"paths":[{"distance":1,"edges":["EDGE-001"],"id":"PATH-001","nodes":["NODE-001","NODE-002"],"risk_domains":["functionality"]}],"providers":[{"confidence":"lexical","executable_sha256":null,"name":"codegraph","status":"missing","version":null},{"confidence":"lexical","executable_sha256":null,"name":"scip","status":"missing","version":null},{"confidence":"lexical","executable_sha256":null,"name":"ast-grep","status":"missing","version":null},{"confidence":"structural-inferred","executable_sha256":null,"name":"builtin","status":"ready","version":"builtin-v1"}],"receipt_id":"02a09669daa0769615ecf1c0f6466ffe","repo_root_sha256":"171a1f5e0da3b27fdd19e9a02b08aab56c3b47193391505d3932bf41bd6d6ff8","request_sha256":"28ab79d5b8f320477fbfab707c70f0c67ae77550fdb689d038f9b3d822af1b34","schema_version":1,"settings":{"deep":false,"enabled":true,"install_policy":"never","max_seconds":30,"providers":["auto"],"target_seconds":10},"timings_ms":{"total":4}}