{"budget_status":"provider_limited","cache":{"invalidated_nodes":[],"key":"8edd74beaf627439390f7a2fbe641364e2bf89f7aa0e3713f1045194dc58f141","status":"miss"},"draft_id":"7cfa0034cc569c22c53e96363a4795a4","edges":[{"confidence":"lexical","evidence":"dashboard.response","id":"EDGE-001","kind":"references","location":"api/dashboard.py","provider":"builtin","source":"NODE-001","source_sha256":"df521886ed199b0e8592ab59303e758b825cc3c24973ce05e4c8180cf8c92966","target":"NODE-002"},{"confidence":"lexical","evidence":"dashboard.response","id":"EDGE-002","kind":"references","location":"events/dashboard_updated.py","provider":"builtin","source":"NODE-001","source_sha256":"736e4294b9bb3dfdb3c5c81d18d9337dbbf639594f6f89497d748ab0eea4f6af","target":"NODE-003"},{"confidence":"lexical","evidence":"dashboard.response","id":"EDGE-003","kind":"references","location":"cache/permission_cache.py","provider":"builtin","source":"NODE-002","source_sha256":"920eec476a4b1c461584a19b739ded7f849a91223b159fa338fde6892917f590","target":"NODE-001"},{"confidence":"lexical","evidence":"dashboard.response","id":"EDGE-004","kind":"references","location":"events/dashboard_updated.py","provider":"builtin","source":"NODE-002","source_sha256":"736e4294b9bb3dfdb3c5c81d18d9337dbbf639594f6f89497d748ab0eea4f6af","target":"NODE-003"},{"confidence":"lexical","evidence":"dashboard.response","id":"EDGE-005","kind":"references","location":"cache/permission_cache.py","provider":"builtin","source":"NODE-003","source_sha256":"920eec476a4b1c461584a19b739ded7f849a91223b159fa338fde6892917f590","target":"NODE-001"},{"confidence":"lexical","evidence":"dashboard.response","id":"EDGE-006","kind":"references","location":"api/dashboard.py","provider":"builtin","source":"NODE-003","source_sha256":"df521886ed199b0e8592ab59303e758b825cc3c24973ce05e4c8180cf8c92966","target":"NODE-002"}],"frontier":[{"id":"FRONTIER-001","node":"NODE-001","reason":"provider unavailable; built-in fallback used: ast-grep, codegraph, scip","risk_domains":["authorization/privacy","state/concurrency"]}],"nodes":[{"confidence":"structural-inferred","id":"NODE-001","kind":"permission","label":"cache/permission_cache.py","location":"cache/permission_cache.py","provider":"builtin","risk_domains":["authorization/privacy","state/concurrency"],"source_sha256":"920eec476a4b1c461584a19b739ded7f849a91223b159fa338fde6892917f590"},{"confidence":"structural-inferred","id":"NODE-002","kind":"api_field","label":"dashboard.response","location":"api/dashboard.py","provider":"builtin","risk_domains":["interfaces"],"source_sha256":"df521886ed199b0e8592ab59303e758b825cc3c24973ce05e4c8180cf8c92966"},{"confidence":"structural-inferred","id":"NODE-003","kind":"event","label":"dashboard.response","location":"events/dashboard_updated.py","provider":"builtin","risk_domains":["operations"],"source_sha256":"736e4294b9bb3dfdb3c5c81d18d9337dbbf639594f6f89497d748ab0eea4f6af"}],"paths":[{"distance":1,"edges":["EDGE-001"],"id":"PATH-001","nodes":["NODE-001","NODE-002"],"risk_domains":["authorization/privacy","interfaces","state/concurrency"]},{"distance":1,"edges":["EDGE-002"],"id":"PATH-002","nodes":["NODE-001","NODE-003"],"risk_domains":["authorization/privacy","state/concurrency","operations"]}],"providers":[{"confidence":"lexical","executable_sha256":null,"name":"codegraph","status":"missing","version":null},{"confidence":"lexical","executable_sha256":null,"name":"scip","status":"missing","version":null},{"confidence":"lexical","executable_sha256":null,"name":"ast-grep","status":"missing","version":null},{"confidence":"structural-inferred","executable_sha256":null,"name":"builtin","status":"ready","version":"builtin-v1"}],"receipt_id":"c3018fcd7549c53204e1f93a13002d86","repo_root_sha256":"4cf69b4f7007ae9dfe4e091339eef3802dfa11425f45955a553c669bb6f40d2d","request_sha256":"c2cd866123b8a2ffe9eadbff2b2f60af67519337992ee330211d6957979f1688","schema_version":1,"settings":{"deep":false,"enabled":true,"install_policy":"never","max_seconds":30,"providers":["auto"],"target_seconds":10},"timings_ms":{"total":6}}