{"budget_status":"provider_limited","cache":{"invalidated_nodes":[],"key":"42b7be76be47202e33030a7bfa6912281a890a48669d8b419687044f76431613","status":"miss"},"draft_id":"90fbeea90e62c4dd0df08ac6d7d58cfa","edges":[{"confidence":"lexical","evidence":"provider timeout","id":"EDGE-001","kind":"references","location":"webhook/idempotency.py","provider":"builtin","source":"NODE-001","source_sha256":"79a0e348ab9d78fc9ea7da81fc66084345010e15f850e8d55441e0ec438e91ad","target":"NODE-002"},{"confidence":"lexical","evidence":"retry_delivery","id":"EDGE-002","kind":"references","location":"first.final.txt","provider":"builtin","source":"NODE-001","source_sha256":"d942da83f440cafeedcc11affa05af9ae353cbad61dec5d19336824e88ae4ede","target":"NODE-003"},{"confidence":"lexical","evidence":"provider timeout","id":"EDGE-003","kind":"references","location":"webhook/delivery.py","provider":"builtin","source":"NODE-002","source_sha256":"d81f4da323713d7116d02f37a268c23afd7f8d612a25d44c120f3f866456cda1","target":"NODE-001"},{"confidence":"lexical","evidence":"configured","id":"EDGE-004","kind":"references","location":"first.final.txt","provider":"builtin","source":"NODE-002","source_sha256":"d942da83f440cafeedcc11affa05af9ae353cbad61dec5d19336824e88ae4ede","target":"NODE-003"},{"confidence":"lexical","evidence":"retry_delivery","id":"EDGE-005","kind":"references","location":"webhook/delivery.py","provider":"builtin","source":"NODE-003","source_sha256":"d81f4da323713d7116d02f37a268c23afd7f8d612a25d44c120f3f866456cda1","target":"NODE-001"},{"confidence":"lexical","evidence":"configured","id":"EDGE-006","kind":"references","location":"webhook/idempotency.py","provider":"builtin","source":"NODE-003","source_sha256":"79a0e348ab9d78fc9ea7da81fc66084345010e15f850e8d55441e0ec438e91ad","target":"NODE-002"}],"frontier":[{"id":"FRONTIER-001","node":"NODE-001","reason":"provider unavailable; built-in fallback used: ast-grep, codegraph, scip","risk_domains":["operations"]}],"nodes":[{"confidence":"structural-inferred","id":"NODE-001","kind":"event","label":"retry_delivery","location":"webhook/delivery.py","provider":"builtin","risk_domains":["operations"],"source_sha256":"d81f4da323713d7116d02f37a268c23afd7f8d612a25d44c120f3f866456cda1"},{"confidence":"structural-inferred","id":"NODE-002","kind":"configuration","label":"idempotency","location":"webhook/idempotency.py","provider":"builtin","risk_domains":["functionality"],"source_sha256":"79a0e348ab9d78fc9ea7da81fc66084345010e15f850e8d55441e0ec438e91ad"},{"confidence":"lexical","id":"NODE-003","kind":"test","label":"first.final.txt","location":"first.final.txt","provider":"builtin","risk_domains":["state/concurrency","operations","regression"],"source_sha256":"d942da83f440cafeedcc11affa05af9ae353cbad61dec5d19336824e88ae4ede"}],"paths":[{"distance":1,"edges":["EDGE-002"],"id":"PATH-001","nodes":["NODE-001","NODE-003"],"risk_domains":["state/concurrency","operations","regression"]},{"distance":1,"edges":["EDGE-001"],"id":"PATH-003","nodes":["NODE-001","NODE-002"],"risk_domains":["operations","functionality"]},{"distance":2,"edges":["EDGE-001","EDGE-004"],"id":"PATH-002","nodes":["NODE-001","NODE-002","NODE-003"],"risk_domains":["state/concurrency","operations","regression","functionality"]}],"providers":[{"confidence":"lexical","executable_sha256":null,"name":"codegraph","status":"missing","version":null},{"confidence":"lexical","executable_sha256":null,"name":"scip","status":"missing","version":null},{"confidence":"lexical","executable_sha256":null,"name":"ast-grep","status":"missing","version":null},{"confidence":"structural-inferred","executable_sha256":null,"name":"builtin","status":"ready","version":"builtin-v1"}],"receipt_id":"84000e4349355207901e4ccde04910ac","repo_root_sha256":"0e00ff4f63aa2ffe726593d853b9745286f0ed662c0e3ffef65f2567995c8a0f","request_sha256":"b95c87e1f133800a653769a3774d9ed0e75d0e49076325439332b54bf0706770","schema_version":1,"settings":{"deep":false,"enabled":true,"install_policy":"never","max_seconds":30,"providers":["auto"],"target_seconds":10},"timings_ms":{"total":18}}