{"budget_status":"provider_limited","cache":{"invalidated_nodes":[],"key":"dc47066ed661eb56217ca69f133df55ae1398fe2af7402e8115feb69f36b7424","status":"miss"},"draft_id":"781c087301dbda89485f9a88b14aaa91","edges":[{"confidence":"lexical","evidence":"authorization.workspace_edit","id":"EDGE-001","kind":"references","location":"events/audit.py","provider":"builtin","source":"NODE-001","source_sha256":"780475004b276787598c9da5d4111a75e8fa64a3e8f132c379a8e89aaa8a3b38","target":"NODE-002"},{"confidence":"lexical","evidence":"authorization.workspace_edit","id":"EDGE-002","kind":"references","location":"roles/defaults.py","provider":"builtin","source":"NODE-001","source_sha256":"4d392f662af6695bdffd200ddf7bc7f721183979c523b36f832bd372633a029d","target":"NODE-003"},{"confidence":"lexical","evidence":"authorization.workspace_edit","id":"EDGE-003","kind":"references","location":"auth/authorize.py","provider":"builtin","source":"NODE-002","source_sha256":"ab14a2f4085aacfa53ccb5b1084f2b3fad07e1a9098b6d9752310b5d3a81cce3","target":"NODE-001"},{"confidence":"lexical","evidence":"authorization.workspace_edit","id":"EDGE-004","kind":"references","location":"roles/defaults.py","provider":"builtin","source":"NODE-002","source_sha256":"4d392f662af6695bdffd200ddf7bc7f721183979c523b36f832bd372633a029d","target":"NODE-003"},{"confidence":"lexical","evidence":"authorization.workspace_edit","id":"EDGE-005","kind":"references","location":"auth/authorize.py","provider":"builtin","source":"NODE-003","source_sha256":"ab14a2f4085aacfa53ccb5b1084f2b3fad07e1a9098b6d9752310b5d3a81cce3","target":"NODE-001"},{"confidence":"lexical","evidence":"authorization.workspace_edit","id":"EDGE-006","kind":"references","location":"events/audit.py","provider":"builtin","source":"NODE-003","source_sha256":"780475004b276787598c9da5d4111a75e8fa64a3e8f132c379a8e89aaa8a3b38","target":"NODE-002"}],"frontier":[{"id":"FRONTIER-001","node":"NODE-001","reason":"provider unavailable; built-in fallback used: ast-grep, codegraph, scip","risk_domains":["authorization/privacy"]}],"nodes":[{"confidence":"structural-inferred","id":"NODE-001","kind":"permission","label":"authorization.workspace_edit","location":"auth/authorize.py","provider":"builtin","risk_domains":["authorization/privacy"],"source_sha256":"ab14a2f4085aacfa53ccb5b1084f2b3fad07e1a9098b6d9752310b5d3a81cce3"},{"confidence":"structural-inferred","id":"NODE-002","kind":"permission","label":"authorization.workspace_edit","location":"events/audit.py","provider":"builtin","risk_domains":["authorization/privacy","operations"],"source_sha256":"780475004b276787598c9da5d4111a75e8fa64a3e8f132c379a8e89aaa8a3b38"},{"confidence":"structural-inferred","id":"NODE-003","kind":"permission","label":"authorization.workspace_edit","location":"roles/defaults.py","provider":"builtin","risk_domains":["authorization/privacy"],"source_sha256":"4d392f662af6695bdffd200ddf7bc7f721183979c523b36f832bd372633a029d"}],"paths":[{"distance":1,"edges":["EDGE-001"],"id":"PATH-001","nodes":["NODE-001","NODE-002"],"risk_domains":["authorization/privacy","operations"]},{"distance":1,"edges":["EDGE-002"],"id":"PATH-002","nodes":["NODE-001","NODE-003"],"risk_domains":["authorization/privacy"]}],"providers":[{"confidence":"lexical","executable_sha256":null,"name":"codegraph","status":"missing","version":null},{"confidence":"lexical","executable_sha256":null,"name":"scip","status":"missing","version":null},{"confidence":"lexical","executable_sha256":null,"name":"ast-grep","status":"missing","version":null},{"confidence":"structural-inferred","executable_sha256":null,"name":"builtin","status":"ready","version":"builtin-v1"}],"receipt_id":"73c26f372620ec276af5a9dab5b0aa1c","repo_root_sha256":"b265120d638c43369b9f82758b69a2745ac1834d3af094fb17c8acb404b2d015","request_sha256":"ea04b2354b822da2cdd8602a8ac3424f658bd82ff3793c961c908ef66111012e","schema_version":1,"settings":{"deep":false,"enabled":true,"install_policy":"never","max_seconds":30,"providers":["auto"],"target_seconds":10},"timings_ms":{"total":3}}