{"budget_status":"provider_limited","cache":{"invalidated_nodes":[],"key":"601e25f44f76df00b6448c5f7fb99565911d13622a3b36899b6b046ad5f76811","status":"miss"},"draft_id":"86d3642347dbad8d23379446b2f401b7","edges":[{"confidence":"lexical","evidence":"profile.displayName","id":"EDGE-001","kind":"references","location":"migrations/profile_field.py","provider":"builtin","source":"NODE-001","source_sha256":"06b1b26723979a51b56cdef2dafa3b418968fac288edb5d81ad81661baf1884c","target":"NODE-002"},{"confidence":"lexical","evidence":"profile.displayName","id":"EDGE-002","kind":"references","location":"mobile/ProfileDecoder.swift","provider":"builtin","source":"NODE-001","source_sha256":"ee5a94ece417550f3c00d6e933f7b31b1ab085169a416418cc9150045355cdc0","target":"NODE-003"},{"confidence":"lexical","evidence":"profile.displayName","id":"EDGE-003","kind":"references","location":"first.final.txt","provider":"builtin","source":"NODE-001","source_sha256":"0d848bf4d75cf7a4661578a15027bea409954a3022b44950cda8b2ea3a28e989","target":"NODE-004"},{"confidence":"lexical","evidence":"profile.displayName","id":"EDGE-004","kind":"references","location":"desktop/ProfileCache.swift","provider":"builtin","source":"NODE-002","source_sha256":"05cdeeb66a5ea203540840f4eb0700e6650107512e70a06c48f13a24ad3b90c8","target":"NODE-001"},{"confidence":"lexical","evidence":"profile.displayName","id":"EDGE-005","kind":"references","location":"mobile/ProfileDecoder.swift","provider":"builtin","source":"NODE-002","source_sha256":"ee5a94ece417550f3c00d6e933f7b31b1ab085169a416418cc9150045355cdc0","target":"NODE-003"},{"confidence":"lexical","evidence":"profile.displayName","id":"EDGE-006","kind":"references","location":"first.final.txt","provider":"builtin","source":"NODE-002","source_sha256":"0d848bf4d75cf7a4661578a15027bea409954a3022b44950cda8b2ea3a28e989","target":"NODE-004"},{"confidence":"lexical","evidence":"profile.displayName","id":"EDGE-007","kind":"references","location":"desktop/ProfileCache.swift","provider":"builtin","source":"NODE-003","source_sha256":"05cdeeb66a5ea203540840f4eb0700e6650107512e70a06c48f13a24ad3b90c8","target":"NODE-001"},{"confidence":"lexical","evidence":"profile.displayName","id":"EDGE-008","kind":"references","location":"migrations/profile_field.py","provider":"builtin","source":"NODE-003","source_sha256":"06b1b26723979a51b56cdef2dafa3b418968fac288edb5d81ad81661baf1884c","target":"NODE-002"},{"confidence":"lexical","evidence":"profile.displayName","id":"EDGE-009","kind":"references","location":"first.final.txt","provider":"builtin","source":"NODE-003","source_sha256":"0d848bf4d75cf7a4661578a15027bea409954a3022b44950cda8b2ea3a28e989","target":"NODE-004"},{"confidence":"lexical","evidence":"profile.displayName","id":"EDGE-010","kind":"references","location":"desktop/ProfileCache.swift","provider":"builtin","source":"NODE-004","source_sha256":"05cdeeb66a5ea203540840f4eb0700e6650107512e70a06c48f13a24ad3b90c8","target":"NODE-001"},{"confidence":"lexical","evidence":"profile.displayName","id":"EDGE-011","kind":"references","location":"migrations/profile_field.py","provider":"builtin","source":"NODE-004","source_sha256":"06b1b26723979a51b56cdef2dafa3b418968fac288edb5d81ad81661baf1884c","target":"NODE-002"},{"confidence":"lexical","evidence":"profile.displayName","id":"EDGE-012","kind":"references","location":"mobile/ProfileDecoder.swift","provider":"builtin","source":"NODE-004","source_sha256":"ee5a94ece417550f3c00d6e933f7b31b1ab085169a416418cc9150045355cdc0","target":"NODE-003"}],"frontier":[{"id":"FRONTIER-001","node":"NODE-001","reason":"provider unavailable; built-in fallback used: ast-grep, codegraph, scip","risk_domains":["data","state/concurrency","compatibility"]}],"nodes":[{"confidence":"structural-inferred","id":"NODE-001","kind":"cache","label":"profile.displayName","location":"desktop/ProfileCache.swift","provider":"builtin","risk_domains":["data","state/concurrency","compatibility"],"source_sha256":"05cdeeb66a5ea203540840f4eb0700e6650107512e70a06c48f13a24ad3b90c8"},{"confidence":"structural-inferred","id":"NODE-002","kind":"file","label":"PRESERVE_RELEASES","location":"migrations/profile_field.py","provider":"builtin","risk_domains":["data","compatibility","regression"],"source_sha256":"06b1b26723979a51b56cdef2dafa3b418968fac288edb5d81ad81661baf1884c"},{"confidence":"structural-inferred","id":"NODE-003","kind":"file","label":"decodeDisplayName","location":"mobile/ProfileDecoder.swift","provider":"builtin","risk_domains":["compatibility"],"source_sha256":"ee5a94ece417550f3c00d6e933f7b31b1ab085169a416418cc9150045355cdc0"},{"confidence":"lexical","id":"NODE-004","kind":"event","label":"first.final.txt","location":"first.final.txt","provider":"builtin","risk_domains":["data","state/concurrency","compatibility","regression"],"source_sha256":"0d848bf4d75cf7a4661578a15027bea409954a3022b44950cda8b2ea3a28e989"}],"paths":[{"distance":1,"edges":["EDGE-001"],"id":"PATH-001","nodes":["NODE-001","NODE-002"],"risk_domains":["data","state/concurrency","compatibility","regression"]},{"distance":1,"edges":["EDGE-002"],"id":"PATH-002","nodes":["NODE-001","NODE-003"],"risk_domains":["data","state/concurrency","compatibility"]},{"distance":1,"edges":["EDGE-003"],"id":"PATH-003","nodes":["NODE-001","NODE-004"],"risk_domains":["data","state/concurrency","compatibility","regression"]}],"providers":[{"confidence":"lexical","executable_sha256":null,"name":"codegraph","status":"missing","version":null},{"confidence":"lexical","executable_sha256":null,"name":"scip","status":"missing","version":null},{"confidence":"lexical","executable_sha256":null,"name":"ast-grep","status":"missing","version":null},{"confidence":"structural-inferred","executable_sha256":null,"name":"builtin","status":"ready","version":"builtin-v1"}],"receipt_id":"d5b4f9e797c71f8ceb1090846967256a","repo_root_sha256":"2518b80befd6273a13229bf34c7d690025bc2d1e2503766ec2fe6ec65be046be","request_sha256":"b27160bac42eb6135f15e3ee2896ee66909cde891f58f67c549345cc5bb093bd","schema_version":1,"settings":{"deep":false,"enabled":true,"install_policy":"never","max_seconds":30,"providers":["auto"],"target_seconds":10},"timings_ms":{"total":25}}