{"budget_status":"provider_limited","cache":{"invalidated_nodes":[],"key":"0813e4b3147e6383ff9cf2bd42a38ede715b5b0e5dc160578f6f7382210a6b4a","status":"miss"},"draft_id":"4478f3c987e5ce0aaaafa1f1d42d057e","edges":[{"confidence":"lexical","evidence":"payment.charge","id":"EDGE-001","kind":"references","location":"providers/gateway.py","provider":"builtin","source":"NODE-001","source_sha256":"a3e9ef607a338b3c35cd0a03b7a51b7f2ea5b3e1e9ce97ef472a0c7b29671a1b","target":"NODE-002"},{"confidence":"lexical","evidence":"payment.charge","id":"EDGE-002","kind":"references","location":"ui/status.py","provider":"builtin","source":"NODE-001","source_sha256":"c476f65bfaf8b8e9ce3dc36a4bc5ad251104f1b5837911f121ab7e1dbe85788e","target":"NODE-003"},{"confidence":"lexical","evidence":"payment.charge","id":"EDGE-003","kind":"references","location":"payments/charge.py","provider":"builtin","source":"NODE-002","source_sha256":"6eb10789a7c69ce2d96a30581dffbb84741a30fdb9c6c9bc52f17f2095317835","target":"NODE-001"},{"confidence":"lexical","evidence":"payment.charge","id":"EDGE-004","kind":"references","location":"ui/status.py","provider":"builtin","source":"NODE-002","source_sha256":"c476f65bfaf8b8e9ce3dc36a4bc5ad251104f1b5837911f121ab7e1dbe85788e","target":"NODE-003"},{"confidence":"lexical","evidence":"payment.charge","id":"EDGE-005","kind":"references","location":"payments/charge.py","provider":"builtin","source":"NODE-003","source_sha256":"6eb10789a7c69ce2d96a30581dffbb84741a30fdb9c6c9bc52f17f2095317835","target":"NODE-001"},{"confidence":"lexical","evidence":"payment.charge","id":"EDGE-006","kind":"references","location":"providers/gateway.py","provider":"builtin","source":"NODE-003","source_sha256":"a3e9ef607a338b3c35cd0a03b7a51b7f2ea5b3e1e9ce97ef472a0c7b29671a1b","target":"NODE-002"}],"frontier":[{"id":"FRONTIER-001","node":"NODE-001","reason":"provider unavailable; built-in fallback used: ast-grep, codegraph, scip","risk_domains":["functionality"]}],"nodes":[{"confidence":"structural-inferred","id":"NODE-001","kind":"file","label":"payment.charge","location":"payments/charge.py","provider":"builtin","risk_domains":["functionality"],"source_sha256":"6eb10789a7c69ce2d96a30581dffbb84741a30fdb9c6c9bc52f17f2095317835"},{"confidence":"structural-inferred","id":"NODE-002","kind":"file","label":"payment.charge","location":"providers/gateway.py","provider":"builtin","risk_domains":["functionality"],"source_sha256":"a3e9ef607a338b3c35cd0a03b7a51b7f2ea5b3e1e9ce97ef472a0c7b29671a1b"},{"confidence":"structural-inferred","id":"NODE-003","kind":"file","label":"payment.charge","location":"ui/status.py","provider":"builtin","risk_domains":["functionality"],"source_sha256":"c476f65bfaf8b8e9ce3dc36a4bc5ad251104f1b5837911f121ab7e1dbe85788e"}],"paths":[{"distance":1,"edges":["EDGE-001"],"id":"PATH-001","nodes":["NODE-001","NODE-002"],"risk_domains":["functionality"]},{"distance":1,"edges":["EDGE-002"],"id":"PATH-002","nodes":["NODE-001","NODE-003"],"risk_domains":["functionality"]}],"providers":[{"confidence":"lexical","executable_sha256":null,"name":"codegraph","status":"missing","version":null},{"confidence":"lexical","executable_sha256":null,"name":"scip","status":"missing","version":null},{"confidence":"lexical","executable_sha256":null,"name":"ast-grep","status":"missing","version":null},{"confidence":"structural-inferred","executable_sha256":null,"name":"builtin","status":"ready","version":"builtin-v1"}],"receipt_id":"2fa2d3a555419b06b0224dc70a538bd0","repo_root_sha256":"e28896059d8a0e26f13d30c3a4aa8f7afa9a9d1d2cd057e6c78440b733aee6e0","request_sha256":"c7e1706880af5902c62db1c240c10c1fad7bb66f215cd13720332ca12afe665c","schema_version":1,"settings":{"deep":false,"enabled":true,"install_policy":"never","max_seconds":30,"providers":["auto"],"target_seconds":10},"timings_ms":{"total":7}}