{"budget_status":"provider_limited","cache":{"invalidated_nodes":[],"key":"c526e5b38a8defac0433c2e7ec9ac82bedfe5ce64ba2110f0964fd38ec60ab65","status":"miss"},"draft_id":"df76e8dc31e49c0a31e4f644a8e01013","edges":[{"confidence":"lexical","evidence":"profile.displayName","id":"EDGE-001","kind":"references","location":"mobile/ProfileDecoder.swift","provider":"builtin","source":"NODE-001","source_sha256":"ee5a94ece417550f3c00d6e933f7b31b1ab085169a416418cc9150045355cdc0","target":"NODE-002"},{"confidence":"lexical","evidence":"profile.displayName","id":"EDGE-002","kind":"references","location":"migrations/profile_field.py","provider":"builtin","source":"NODE-002","source_sha256":"06b1b26723979a51b56cdef2dafa3b418968fac288edb5d81ad81661baf1884c","target":"NODE-001"}],"frontier":[{"id":"FRONTIER-001","node":"NODE-001","reason":"provider unavailable; built-in fallback used: ast-grep, codegraph, scip","risk_domains":["data","compatibility","regression"]}],"nodes":[{"confidence":"structural-inferred","id":"NODE-001","kind":"file","label":"migrations/profile_field.py","location":"migrations/profile_field.py","provider":"builtin","risk_domains":["data","compatibility","regression"],"source_sha256":"06b1b26723979a51b56cdef2dafa3b418968fac288edb5d81ad81661baf1884c"},{"confidence":"structural-inferred","id":"NODE-002","kind":"file","label":"mobile/ProfileDecoder.swift","location":"mobile/ProfileDecoder.swift","provider":"builtin","risk_domains":["compatibility"],"source_sha256":"ee5a94ece417550f3c00d6e933f7b31b1ab085169a416418cc9150045355cdc0"}],"paths":[{"distance":1,"edges":["EDGE-001"],"id":"PATH-001","nodes":["NODE-001","NODE-002"],"risk_domains":["data","compatibility","regression"]}],"providers":[{"confidence":"lexical","executable_sha256":null,"name":"codegraph","status":"missing","version":null},{"confidence":"lexical","executable_sha256":null,"name":"scip","status":"missing","version":null},{"confidence":"lexical","executable_sha256":null,"name":"ast-grep","status":"missing","version":null},{"confidence":"structural-inferred","executable_sha256":null,"name":"builtin","status":"ready","version":"builtin-v1"}],"receipt_id":"1451adb626350224ac5fff9313ae5ee4","repo_root_sha256":"182d871e0da1dd64554ce6a33d50c9b834fe3688bd442d8642dc217f73c8fac8","request_sha256":"49b72461e3f0b097bf256aa39870cb30455879ed87cfe52a590d4b67dfce086a","schema_version":1,"settings":{"deep":false,"enabled":true,"install_policy":"never","max_seconds":30,"providers":["auto"],"target_seconds":10},"timings_ms":{"total":9}}