{"budget_status":"provider_limited","cache":{"invalidated_nodes":[],"key":"99ae847ea1280de9022528505d80add3e004a30a66435054eb2010136d872146","status":"miss"},"draft_id":"946a35c2a8e7110f5a0bf11d77eef09a","edges":[{"confidence":"lexical","evidence":"profile.displayName","id":"EDGE-001","kind":"references","location":"ios/UserDTO.swift","provider":"builtin","source":"NODE-001","source_sha256":"9c8612f5cba0abca20670af31d188cf27593462e9e98efbc7f391793225a8b53","target":"NODE-002"},{"confidence":"lexical","evidence":"profile.displayName","id":"EDGE-002","kind":"references","location":"cache/profile_cache.py","provider":"builtin","source":"NODE-001","source_sha256":"1b1f70d7869c3a58ad6c5f8a8ed31280825ffb2a4a26a912b53b7bd04fe48b4b","target":"NODE-003"},{"confidence":"lexical","evidence":"profile.displayName","id":"EDGE-003","kind":"references","location":"docs/changelog.py","provider":"builtin","source":"NODE-001","source_sha256":"6927ae599acd74589c4874a5be0e222b422d2db37cbafcc14c1324145c5ec54c","target":"NODE-004"},{"confidence":"lexical","evidence":"profile.displayName","id":"EDGE-004","kind":"references","location":"api/profile.py","provider":"builtin","source":"NODE-002","source_sha256":"787c945bda0326882ede5dda013c1faa0d853f3e201356fb7cb0c4f8e117cca7","target":"NODE-001"},{"confidence":"lexical","evidence":"profile.displayName","id":"EDGE-005","kind":"references","location":"cache/profile_cache.py","provider":"builtin","source":"NODE-002","source_sha256":"1b1f70d7869c3a58ad6c5f8a8ed31280825ffb2a4a26a912b53b7bd04fe48b4b","target":"NODE-003"},{"confidence":"lexical","evidence":"profile.displayName","id":"EDGE-006","kind":"references","location":"docs/changelog.py","provider":"builtin","source":"NODE-002","source_sha256":"6927ae599acd74589c4874a5be0e222b422d2db37cbafcc14c1324145c5ec54c","target":"NODE-004"},{"confidence":"lexical","evidence":"profile.displayName","id":"EDGE-007","kind":"references","location":"api/profile.py","provider":"builtin","source":"NODE-003","source_sha256":"787c945bda0326882ede5dda013c1faa0d853f3e201356fb7cb0c4f8e117cca7","target":"NODE-001"},{"confidence":"lexical","evidence":"profile.displayName","id":"EDGE-008","kind":"references","location":"ios/UserDTO.swift","provider":"builtin","source":"NODE-003","source_sha256":"9c8612f5cba0abca20670af31d188cf27593462e9e98efbc7f391793225a8b53","target":"NODE-002"},{"confidence":"lexical","evidence":"profile.displayName","id":"EDGE-009","kind":"references","location":"docs/changelog.py","provider":"builtin","source":"NODE-003","source_sha256":"6927ae599acd74589c4874a5be0e222b422d2db37cbafcc14c1324145c5ec54c","target":"NODE-004"},{"confidence":"lexical","evidence":"profile.displayName","id":"EDGE-010","kind":"references","location":"api/profile.py","provider":"builtin","source":"NODE-004","source_sha256":"787c945bda0326882ede5dda013c1faa0d853f3e201356fb7cb0c4f8e117cca7","target":"NODE-001"},{"confidence":"lexical","evidence":"profile.displayName","id":"EDGE-011","kind":"references","location":"ios/UserDTO.swift","provider":"builtin","source":"NODE-004","source_sha256":"9c8612f5cba0abca20670af31d188cf27593462e9e98efbc7f391793225a8b53","target":"NODE-002"},{"confidence":"lexical","evidence":"profile.displayName","id":"EDGE-012","kind":"references","location":"cache/profile_cache.py","provider":"builtin","source":"NODE-004","source_sha256":"1b1f70d7869c3a58ad6c5f8a8ed31280825ffb2a4a26a912b53b7bd04fe48b4b","target":"NODE-003"}],"frontier":[{"id":"FRONTIER-001","node":"NODE-001","reason":"provider unavailable; built-in fallback used: ast-grep, codegraph, scip","risk_domains":["interfaces"]}],"nodes":[{"confidence":"structural-inferred","id":"NODE-001","kind":"api_field","label":"profile.displayName","location":"api/profile.py","provider":"builtin","risk_domains":["interfaces"],"source_sha256":"787c945bda0326882ede5dda013c1faa0d853f3e201356fb7cb0c4f8e117cca7"},{"confidence":"structural-inferred","id":"NODE-002","kind":"api_field","label":"profile.displayName","location":"ios/UserDTO.swift","provider":"builtin","risk_domains":["interfaces"],"source_sha256":"9c8612f5cba0abca20670af31d188cf27593462e9e98efbc7f391793225a8b53"},{"confidence":"structural-inferred","id":"NODE-003","kind":"cache","label":"profile.displayName","location":"cache/profile_cache.py","provider":"builtin","risk_domains":["state/concurrency"],"source_sha256":"1b1f70d7869c3a58ad6c5f8a8ed31280825ffb2a4a26a912b53b7bd04fe48b4b"},{"confidence":"structural-inferred","id":"NODE-004","kind":"file","label":"docs/changelog.py","location":"docs/changelog.py","provider":"builtin","risk_domains":["functionality"],"source_sha256":"6927ae599acd74589c4874a5be0e222b422d2db37cbafcc14c1324145c5ec54c"}],"paths":[{"distance":1,"edges":["EDGE-001"],"id":"PATH-001","nodes":["NODE-001","NODE-002"],"risk_domains":["interfaces"]},{"distance":1,"edges":["EDGE-002"],"id":"PATH-002","nodes":["NODE-001","NODE-003"],"risk_domains":["interfaces","state/concurrency"]},{"distance":1,"edges":["EDGE-003"],"id":"PATH-003","nodes":["NODE-001","NODE-004"],"risk_domains":["interfaces","functionality"]}],"providers":[{"confidence":"lexical","executable_sha256":null,"name":"codegraph","status":"missing","version":null},{"confidence":"lexical","executable_sha256":null,"name":"scip","status":"missing","version":null},{"confidence":"lexical","executable_sha256":null,"name":"ast-grep","status":"missing","version":null},{"confidence":"structural-inferred","executable_sha256":null,"name":"builtin","status":"ready","version":"builtin-v1"}],"receipt_id":"b8c8f74bbf95b251eae4fbf47e7bd12d","repo_root_sha256":"bbcd60baf5039429f55f2158a6855df2c4edeee6dcc452cfb126393269077842","request_sha256":"f7da95d055e5960c33f8c0938e6dd97c03a8bc7ae7e7e78b110c76d890b3bbd8","schema_version":1,"settings":{"deep":false,"enabled":true,"install_policy":"never","max_seconds":30,"providers":["auto"],"target_seconds":10},"timings_ms":{"total":7}}