{"budget_status":"provider_limited","cache":{"invalidated_nodes":[],"key":"312db9cc8840d7aebb3cae437aaccce36b8009d41040e508ce56084192038ec3","status":"miss"},"draft_id":"b67dcb2cb33ac2f089fbfbb63f0a1ab6","edges":[{"confidence":"lexical","evidence":"export.jobs","id":"EDGE-001","kind":"references","location":"workers/export.py","provider":"builtin","source":"NODE-001","source_sha256":"c162e11f2550d94334305cc16e8ead361a223416e9027e00da69d67f1a1da1e0","target":"NODE-002"},{"confidence":"lexical","evidence":"export.jobs","id":"EDGE-002","kind":"references","location":"alerts/dead_letter.py","provider":"builtin","source":"NODE-002","source_sha256":"03cf434c996975010586075c336f173fa1fef6219ef79b0fefe5679fce55f6a5","target":"NODE-001"}],"frontier":[{"id":"FRONTIER-001","node":"NODE-001","reason":"provider unavailable; built-in fallback used: ast-grep, codegraph, scip","risk_domains":["functionality"]}],"nodes":[{"confidence":"structural-inferred","id":"NODE-001","kind":"file","label":"alerts/dead_letter.py","location":"alerts/dead_letter.py","provider":"builtin","risk_domains":["functionality"],"source_sha256":"03cf434c996975010586075c336f173fa1fef6219ef79b0fefe5679fce55f6a5"},{"confidence":"structural-inferred","id":"NODE-002","kind":"file","label":"export.jobs","location":"workers/export.py","provider":"builtin","risk_domains":["functionality"],"source_sha256":"c162e11f2550d94334305cc16e8ead361a223416e9027e00da69d67f1a1da1e0"}],"paths":[{"distance":1,"edges":["EDGE-001"],"id":"PATH-001","nodes":["NODE-001","NODE-002"],"risk_domains":["functionality"]}],"providers":[{"confidence":"lexical","executable_sha256":null,"name":"codegraph","status":"missing","version":null},{"confidence":"lexical","executable_sha256":null,"name":"scip","status":"missing","version":null},{"confidence":"lexical","executable_sha256":null,"name":"ast-grep","status":"missing","version":null},{"confidence":"structural-inferred","executable_sha256":null,"name":"builtin","status":"ready","version":"builtin-v1"}],"receipt_id":"99fe17f213aa435ca588548b9ea0b938","repo_root_sha256":"dac401510c622d52130097a1f1439bb82f3c8197b0e3e69f72037fa0cdcf6f6e","request_sha256":"797b4508dbf8923c0f8db53c8e44521e5da4744ac00d597f883ab9e0c7ffac1f","schema_version":1,"settings":{"deep":false,"enabled":true,"install_policy":"never","max_seconds":30,"providers":["auto"],"target_seconds":10},"timings_ms":{"total":5}}