{"budget_status":"provider_limited","cache":{"invalidated_nodes":[],"key":"848a05950d3dcbcf284a3a0b293b4abf414cbee2749279dad30e2be0cc5bb56b","status":"miss"},"draft_id":"c6b1d9d6c4d54fccdd800b9b1b4ab2e5","edges":[{"confidence":"lexical","evidence":"provider timeout","id":"EDGE-001","kind":"references","location":"first.final.txt","provider":"builtin","source":"NODE-001","source_sha256":"899774eef7b7de6aee987d9f27f7b83ddf160d0e9896566210d41670563938e7","target":"NODE-002"},{"confidence":"lexical","evidence":"provider timeout","id":"EDGE-002","kind":"references","location":"webhook/idempotency.py","provider":"builtin","source":"NODE-001","source_sha256":"79a0e348ab9d78fc9ea7da81fc66084345010e15f850e8d55441e0ec438e91ad","target":"NODE-003"},{"confidence":"lexical","evidence":"provider timeout","id":"EDGE-003","kind":"references","location":"webhook/delivery.py","provider":"builtin","source":"NODE-002","source_sha256":"d81f4da323713d7116d02f37a268c23afd7f8d612a25d44c120f3f866456cda1","target":"NODE-001"},{"confidence":"lexical","evidence":"provider timeout","id":"EDGE-004","kind":"references","location":"webhook/idempotency.py","provider":"builtin","source":"NODE-002","source_sha256":"79a0e348ab9d78fc9ea7da81fc66084345010e15f850e8d55441e0ec438e91ad","target":"NODE-003"},{"confidence":"lexical","evidence":"provider timeout","id":"EDGE-005","kind":"references","location":"webhook/delivery.py","provider":"builtin","source":"NODE-003","source_sha256":"d81f4da323713d7116d02f37a268c23afd7f8d612a25d44c120f3f866456cda1","target":"NODE-001"},{"confidence":"lexical","evidence":"provider timeout","id":"EDGE-006","kind":"references","location":"first.final.txt","provider":"builtin","source":"NODE-003","source_sha256":"899774eef7b7de6aee987d9f27f7b83ddf160d0e9896566210d41670563938e7","target":"NODE-002"}],"frontier":[{"id":"FRONTIER-001","node":"NODE-002","reason":"provider unavailable; built-in fallback used: ast-grep, codegraph, scip","risk_domains":["interfaces","state/concurrency","compatibility","operations","regression"]}],"nodes":[{"confidence":"structural-inferred","id":"NODE-001","kind":"event","label":"webhook/delivery.py","location":"webhook/delivery.py","provider":"builtin","risk_domains":["operations"],"source_sha256":"d81f4da323713d7116d02f37a268c23afd7f8d612a25d44c120f3f866456cda1"},{"confidence":"lexical","id":"NODE-002","kind":"test","label":"first.final.txt","location":"first.final.txt","provider":"builtin","risk_domains":["interfaces","state/concurrency","compatibility","operations","regression"],"source_sha256":"899774eef7b7de6aee987d9f27f7b83ddf160d0e9896566210d41670563938e7"},{"confidence":"lexical","id":"NODE-003","kind":"configuration","label":"webhook/idempotency.py","location":"webhook/idempotency.py","provider":"builtin","risk_domains":["functionality"],"source_sha256":"79a0e348ab9d78fc9ea7da81fc66084345010e15f850e8d55441e0ec438e91ad"}],"paths":[{"distance":1,"edges":["EDGE-001"],"id":"PATH-001","nodes":["NODE-001","NODE-002"],"risk_domains":["interfaces","state/concurrency","compatibility","operations","regression"]},{"distance":1,"edges":["EDGE-002"],"id":"PATH-002","nodes":["NODE-001","NODE-003"],"risk_domains":["operations","functionality"]}],"providers":[{"confidence":"lexical","executable_sha256":null,"name":"codegraph","status":"missing","version":null},{"confidence":"lexical","executable_sha256":null,"name":"scip","status":"missing","version":null},{"confidence":"lexical","executable_sha256":null,"name":"ast-grep","status":"missing","version":null},{"confidence":"structural-inferred","executable_sha256":null,"name":"builtin","status":"ready","version":"builtin-v1"}],"receipt_id":"1e7da651c0b91c6c694f3ebbe00734d1","repo_root_sha256":"339cf36be914995dcd383ba77c3bd8dd691aa276adefb7d55edb609a2615f7fc","request_sha256":"c7946cdf6c6ef8c8708755c084a477b3f1feb174f48d3f6cf7da4ce1f24f6051","schema_version":1,"settings":{"deep":false,"enabled":true,"install_policy":"never","max_seconds":30,"providers":["auto"],"target_seconds":10},"timings_ms":{"total":15}}