{"budget_status":"provider_limited","cache":{"invalidated_nodes":[],"key":"0f5b1c3175c95a7fb2e1c93d468f33ac66ea69a4ed1e1f2b8fee59f50103486d","status":"miss"},"draft_id":"012b9af0d91cd08b0f0c144c86c1fb0d","edges":[{"confidence":"lexical","evidence":"tenant archive","id":"EDGE-001","kind":"references","location":"policy/retention.py","provider":"builtin","source":"NODE-001","source_sha256":"01622f90487d1aa34520422a0fc1caf523fa7d595501377badcfda0d2da1fe53","target":"NODE-002"},{"confidence":"lexical","evidence":"write_tenant_archive","id":"EDGE-002","kind":"references","location":"first.final.txt","provider":"builtin","source":"NODE-001","source_sha256":"5049a481dbd0a3313033fdafc4ffcdf11fafac8e7e8db9979c2490b5769c1b64","target":"NODE-003"},{"confidence":"lexical","evidence":"tenant archive","id":"EDGE-003","kind":"references","location":"exports/export_writer.py","provider":"builtin","source":"NODE-002","source_sha256":"2f6be1943c2b584daa6b729b5cc2cd76807820b17cdfa7296a30b0049ad5709f","target":"NODE-001"},{"confidence":"lexical","evidence":"RETENTION_POLICY","id":"EDGE-004","kind":"references","location":"first.final.txt","provider":"builtin","source":"NODE-002","source_sha256":"5049a481dbd0a3313033fdafc4ffcdf11fafac8e7e8db9979c2490b5769c1b64","target":"NODE-003"},{"confidence":"lexical","evidence":"write_tenant_archive","id":"EDGE-005","kind":"references","location":"exports/export_writer.py","provider":"builtin","source":"NODE-003","source_sha256":"2f6be1943c2b584daa6b729b5cc2cd76807820b17cdfa7296a30b0049ad5709f","target":"NODE-001"},{"confidence":"lexical","evidence":"RETENTION_POLICY","id":"EDGE-006","kind":"references","location":"policy/retention.py","provider":"builtin","source":"NODE-003","source_sha256":"01622f90487d1aa34520422a0fc1caf523fa7d595501377badcfda0d2da1fe53","target":"NODE-002"}],"frontier":[{"id":"FRONTIER-001","node":"NODE-003","reason":"provider unavailable; built-in fallback used: ast-grep, codegraph, scip","risk_domains":["authorization/privacy","data","state/concurrency","compatibility","regression"]}],"nodes":[{"confidence":"structural-inferred","id":"NODE-001","kind":"file","label":"write_tenant_archive","location":"exports/export_writer.py","provider":"builtin","risk_domains":["functionality"],"source_sha256":"2f6be1943c2b584daa6b729b5cc2cd76807820b17cdfa7296a30b0049ad5709f"},{"confidence":"structural-inferred","id":"NODE-002","kind":"file","label":"RETENTION_OWNER","location":"policy/retention.py","provider":"builtin","risk_domains":["functionality"],"source_sha256":"01622f90487d1aa34520422a0fc1caf523fa7d595501377badcfda0d2da1fe53"},{"confidence":"lexical","id":"NODE-003","kind":"test","label":"first.final.txt","location":"first.final.txt","provider":"builtin","risk_domains":["authorization/privacy","data","state/concurrency","compatibility","regression"],"source_sha256":"5049a481dbd0a3313033fdafc4ffcdf11fafac8e7e8db9979c2490b5769c1b64"}],"paths":[{"distance":1,"edges":["EDGE-002"],"id":"PATH-001","nodes":["NODE-001","NODE-003"],"risk_domains":["authorization/privacy","data","state/concurrency","compatibility","regression","functionality"]},{"distance":2,"edges":["EDGE-002","EDGE-006"],"id":"PATH-002","nodes":["NODE-001","NODE-003","NODE-002"],"risk_domains":["authorization/privacy","data","state/concurrency","compatibility","regression","functionality"]},{"distance":1,"edges":["EDGE-001"],"id":"PATH-003","nodes":["NODE-001","NODE-002"],"risk_domains":["functionality"]}],"providers":[{"confidence":"lexical","executable_sha256":null,"name":"codegraph","status":"missing","version":null},{"confidence":"lexical","executable_sha256":null,"name":"scip","status":"missing","version":null},{"confidence":"lexical","executable_sha256":null,"name":"ast-grep","status":"missing","version":null},{"confidence":"structural-inferred","executable_sha256":null,"name":"builtin","status":"ready","version":"builtin-v1"}],"receipt_id":"2cc0168862ce09dc8f4eda2f4fa3de40","repo_root_sha256":"9f6ef301bdc78964d3241a6643fb5504ba6340b201d5b7925716341e7b146a30","request_sha256":"2973144277870a2bbf24c68302413da2e535a98b87f5fb6fac58f19c5e1c7285","schema_version":1,"settings":{"deep":false,"enabled":true,"install_policy":"never","max_seconds":30,"providers":["auto"],"target_seconds":10},"timings_ms":{"total":23}}