{"budget_status":"provider_limited","cache":{"invalidated_nodes":[],"key":"df20c0daec52c751e56c5b125de9c3c063ece92ae9ef1a2612ec479acb8b0c2e","status":"miss"},"draft_id":"d750de149d91e2ea88aeebc9f3ef60a5","edges":[],"frontier":[{"id":"FRONTIER-001","node":"NODE-001","reason":"provider unavailable; built-in fallback used: ast-grep, codegraph, scip","risk_domains":["interfaces"]}],"nodes":[{"confidence":"structural-inferred","id":"NODE-001","kind":"api_field","label":"dashboard.response","location":"api/dashboard.py","provider":"builtin","risk_domains":["interfaces"],"source_sha256":"a644e43ee2fc0c2c29ec0917d3f02e686aedb5eed1435271988853d34ee13eb7"}],"paths":[],"providers":[{"confidence":"lexical","executable_sha256":null,"name":"codegraph","status":"missing","version":null},{"confidence":"lexical","executable_sha256":null,"name":"scip","status":"missing","version":null},{"confidence":"lexical","executable_sha256":null,"name":"ast-grep","status":"missing","version":null},{"confidence":"structural-inferred","executable_sha256":null,"name":"builtin","status":"ready","version":"builtin-v1"}],"receipt_id":"e4833bdfabba335520151b70b72eabd4","repo_root_sha256":"989ded6bc95fca065cce323700e1e53df4bf1adea4cfb110e2023c247286d1cc","request_sha256":"7175f9d249a3b2fd7ef2f47bdd2477c834b827ed50a6887f22440d5546439635","schema_version":1,"settings":{"deep":false,"enabled":true,"install_policy":"never","max_seconds":30,"providers":["auto"],"target_seconds":10},"timings_ms":{"total":2}}